id,animal
100,A watercolor painting of a cat
101,A digital illustration of a dog
102,A charcoal sketch of a rabbit
103,A clay sculpture of an owl
104,An oil painting of a fox
105,A pencil drawing of a horse
106,A digital painting of a penguin
107,A watercolor of a bear
108,An ink sketch of a raccoon
109,A pastel drawing of a lion
110,A 3D render of a giraffe
111,An acrylic painting of a koala
112,A digital illustration of a hedgehog
113,A sculpture of a dolphin
114,A charcoal drawing of a wolf
115,A mosaic of a zebra
116,A collage of a panda
117,A digital sketch of a ferret
118,A stained glass artwork of a parrot
119,A pen-and-ink drawing of a sloth
120,A chalk drawing of a moose
121,A lithograph of a bat
122,A crayon drawing of a guinea pig
123,A textile art piece of a chameleon
124,A gouache painting of a kangaroo
125,A printmaking piece of a sea otter
126,A clay model of a shark
127,An embroidery of an armadillo
128,A digital collage of a bison
129,A paper cut-out of a flamingo
130,A pixel art of a catfish
131,A wire sculpture of a turkey
132,A linocut print of a meerkat
133,A colored pencil drawing of a narwhal
134,A crochet piece of a red panda
135,A holographic print of a platypus
136,A paper mache of a seahorse
137,A glass sculpture of a starling
138,An oil pastel of a snow leopard
139,A ceramic figure of a possum
140,A spray paint mural of a stingray
141,A digital vector of a lynx
142,A relief print of a beaver
143,A soft pastel of a crow
144,A wood carving of a jaguar
145,A needle-felted model of a mink
146,A pointillist painting of a puffin
147,A metal engraving of a falcon
148,A stippling ink drawing of a wombat
149,A calligraphy piece of a swan
150,A steampunk illustration of a crow
151,A sumi-e ink painting of a carp
152,A silhouette cut-out of a buffalo
153,A vintage poster of a peacock
154,A photorealistic painting of a tarantula
155,A fantasy illustration of a dragon
156,A sci-fi concept art of a robotic cat
157,A medieval tapestry of a unicorn
158,A Baroque oil painting of a stag
159,A pop art print of a tiger
160,A minimalist sketch of a gecko
161,An Art Deco print of a greyhound
162,A futuristic 3D render of a cyborg wolf
163,A cubist painting of a toucan
164,A vaporwave digital art of a jellyfish
165,A Renaissance-style fresco of a hawk
166,An anime-style illustration of a fox
167,A fantasy map showing a dragon
168,A comic book panel of a raccoon
169,A horror concept art of a bat
170,A surrealist painting of a flamingo
171,A pixelated game sprite of a frog
172,A digital trading card of a cobra
173,A storybook illustration of a rabbit
174,A botanical print of a moth
175,A gothic ink drawing of a raven
176,A sepia-toned photograph of a walrus
177,A cosmic sci-fi painting of an alien cat
178,A pastel dreamscape of a sea turtle
179,A cyberpunk poster of a lizard
180,A neoclassical sculpture of a sphinx cat
181,An art nouveau print of a fox
182,A photomanipulation of a cheetah
183,A glitch art piece of a parrot
184,A zentangle drawing of a squirrel
185,A nature documentary still of a platypus
186,A Polaroid photo of a goat
187,A mixed-media collage of a shark
188,A mosaic tile of a lynx
189,A silhouette paper art of a raven
190,An isometric illustration of a hamster
191,A 16-bit game sprite of a bear
192,A glitchy VHS still of a raccoon
193,A holographic sticker of a penguin
194,A kinetic sculpture of a jellyfish
195,A whimsical cartoon of a deer
196,A retro-futuristic poster of a robot dog
197,A folk art carving of a rabbit
198,A noir detective sketch of a fox
199,A celestial-inspired painting of a wolf
